{"authority":"algorithmic","branches":[{"branch_id":"main","parent":null,"status":"active"}],"canonical_tick":0,"entities":[{"class":"stone","id":"stone-01","kind":"inanimate","state":"rest"},{"class":"stone","id":"stone-02","kind":"inanimate","state":"rest"},{"class":"gate","id":"gate-01","kind":"inanimate","state":"closed"},{"class":"light","id":"light-01","kind":"inanimate","state":"dim"},{"class":"tree","id":"tree-01","kind":"inanimate","state":"stable"},{"class":"tree","id":"tree-02","kind":"inanimate","state":"stable"},{"class":"stream","id":"water-01","kind":"inanimate","state":"flow"},{"class":"hive","id":"hive-01","kind":"animate","state":"active"},{"class":"observer","id":"observer-01","kind":"animate","state":"watch"},{"class":"caretaker","id":"gardener-01","kind":"animate","state":"ready"}],"event_log":[],"kernel_seed":"ak.seed.world0.orchard_garden_lattice.v0","profile":"orchard_garden_lattice.v0","projection_views":[{"authority":"advisory","format":"application/json","id":"json_text_v0"}],"proposal_queue":[{"pending":[],"queue_id":"main"}],"receipts":[],"relations":[{"from":"stone-01","to":"gate-01","type":"adjacent"},{"from":"gate-01","to":"light-01","type":"adjacent"},{"from":"tree-01","to":"water-01","type":"adjacent"},{"from":"water-01","to":"tree-01","type":"nurtures"},{"from":"water-01","to":"tree-02","type":"nurtures"},{"from":"observer-01","to":"gate-01","type":"observes"},{"from":"observer-01","to":"hive-01","type":"observes"},{"from":"gardener-01","to":"tree-01","type":"observes"}],"v":"world.v0","world_id":"world0-orchard-garden-lattice"}
